{
  "body": {
    "exchangePattern": "request_reply",
    "intent": "command",
    "name": "volumeDown",
    "params": {
      "subscriberId": "sub-1",
      "zone": "Kitchen"
    },
    "serviceNamespace": "dev.deckr.sonos.service"
  },
  "contract": {
    "contractId": "service-use-contract-1",
    "generation": 1
  },
  "createdAt": "2026-04-29T10:00:00Z",
  "lane": "services",
  "messageId": "fixture-service-message",
  "messageType": "serviceMessage",
  "protocolVersion": "1",
  "recipient": {
    "endpoint": "service:sonos-home",
    "targetType": "endpoint"
  },
  "recipientSessionId": "service-session",
  "schemaVersion": "1",
  "sender": "controller:controller-main",
  "senderSessionId": "controller-session",
  "subject": {
    "identifiers": {
      "name": "volumeDown",
      "namespace": "dev.deckr.sonos.service",
      "serviceId": "sonos-home"
    },
    "kind": "service"
  }
}
