{
  "body": {
    "event": {
      "binding": {
        "actionId": "example",
        "actionInstanceId": "example",
        "bindingId": "example",
        "configId": "example",
        "contextId": "example",
        "controlRef": {
          "controlId": "example",
          "deviceRef": {
            "deviceId": "deck-1",
            "fingerprint": "fingerprint:deck-1",
            "managerId": "mirabox-main"
          }
        },
        "deviceRef": {
          "deviceId": "deck-1",
          "fingerprint": "fingerprint:deck-1",
          "managerId": "mirabox-main"
        },
        "providerId": "example",
        "providerInstanceId": "example"
      },
      "event": {
        "capability": {
          "capabilityId": "button",
          "controlId": "button-1",
          "deviceRef": {
            "deviceId": "deck-1",
            "fingerprint": "fingerprint:deck-1",
            "managerId": "mirabox-main"
          }
        },
        "eventType": "example",
        "occurredAt": "2026-04-29T10:00:00Z"
      }
    },
    "exchangePattern": "one_way",
    "intent": "event",
    "name": "capability_input",
    "params": {},
    "serviceNamespace": "dev.deckr.action_runtime.provider"
  },
  "contract": {
    "contractId": "action-runtime-contract-1",
    "generation": 1
  },
  "createdAt": "2026-04-29T10:00:00Z",
  "lane": "services",
  "messageId": "fixture-action-runtime-action-instance-created",
  "messageType": "serviceMessage",
  "protocolVersion": "1",
  "recipient": {
    "endpoint": "service:action-runtime.clock-main",
    "targetType": "endpoint"
  },
  "recipientSessionId": "service-session",
  "schemaVersion": "1",
  "sender": "controller:controller-main",
  "senderSessionId": "controller-session",
  "subject": {
    "identifiers": {
      "name": "capability_input",
      "namespace": "dev.deckr.action_runtime.provider",
      "serviceId": "action-runtime.clock-main"
    },
    "kind": "service"
  }
}
