{
  "body": {
    "descriptor": {
      "capabilities": [],
      "connections": [],
      "controls": [
        {
          "configCapabilities": [],
          "controlId": "key.0.0",
          "diagnosticCapabilities": [],
          "geometry": {
            "height": 1.0,
            "unit": "grid",
            "width": 1.0,
            "x": 0.0,
            "y": 0.0
          },
          "inputCapabilities": [
            {
              "access": [
                "emits"
              ],
              "capabilityId": "button.press",
              "commandTypes": [],
              "constraints": [],
              "direction": "input",
              "eventTypes": [
                "press"
              ],
              "family": "dev.deckr.input.button",
              "sources": [],
              "type": "activation",
              "units": [],
              "valueSchema": {
                "schema": {
                  "additionalProperties": false,
                  "properties": {
                    "eventType": {
                      "const": "press"
                    }
                  },
                  "required": [
                    "eventType"
                  ],
                  "type": "object"
                },
                "schemaId": "dev.deckr.value.input.button.activation.v1"
              }
            }
          ],
          "kind": "key",
          "outputCapabilities": [
            {
              "access": [
                "invokable"
              ],
              "capabilityId": "screen",
              "commandSchema": {
                "schema": {
                  "oneOf": [
                    {
                      "additionalProperties": false,
                      "properties": {
                        "encoding": {
                          "enum": [
                            "jpeg",
                            "png"
                          ]
                        },
                        "image": {
                          "contentEncoding": "base64",
                          "type": "string"
                        }
                      },
                      "required": [
                        "image",
                        "encoding"
                      ],
                      "type": "object"
                    },
                    {
                      "maxProperties": 0,
                      "type": "object"
                    }
                  ]
                },
                "schemaId": "dev.deckr.command.output.raster.bitmap.v1"
              },
              "commandTypes": [
                "set_frame",
                "clear"
              ],
              "constraints": [],
              "direction": "output",
              "eventTypes": [],
              "family": "dev.deckr.output.raster",
              "sources": [],
              "type": "bitmap",
              "units": []
            }
          ],
          "relatedControlIds": [],
          "sources": [],
          "stateCapabilities": []
        }
      ],
      "deviceId": "deck-1",
      "displayName": "Example Deck",
      "fingerprint": "fingerprint:deck-1",
      "identifiers": [],
      "manufacturer": "Deckr",
      "model": "Fixture Panel",
      "sources": []
    }
  },
  "createdAt": "2026-04-29T10:00:00Z",
  "lane": "hardware_messages",
  "messageId": "fixture-hardware-device-available",
  "messageType": "deviceAvailable",
  "protocolVersion": "1",
  "recipient": {
    "endpointFamily": "controller",
    "scope": "controllers",
    "targetType": "broadcast"
  },
  "schemaVersion": "1",
  "sender": "hardware_manager:mirabox-main",
  "senderSessionId": "manager-session",
  "subject": {
    "identifiers": {
      "deviceId": "deck-1",
      "managerId": "mirabox-main"
    },
    "kind": "hardware_device"
  }
}
