{
  "body": {
    "operation": "play",
    "params": {
      "zone": "kitchen"
    },
    "serviceNamespace": "org.example.media.service"
  },
  "createdAt": "2026-04-29T10:00:00Z",
  "lane": "services",
  "messageId": "fixture-service-command",
  "messageType": "serviceCommand",
  "protocolVersion": "1",
  "recipient": {
    "endpoint": "service:media-home",
    "targetType": "endpoint"
  },
  "recipientSessionId": "service-session",
  "schemaVersion": "1",
  "sender": "controller:controller-main",
  "senderSessionId": "controller-session",
  "subject": {
    "identifiers": {
      "namespace": "org.example.media.service",
      "operation": "play",
      "serviceId": "media-home"
    },
    "kind": "service"
  }
}
