{
  "body": {
    "capabilityId": "example",
    "deviceRef": {
      "deviceId": "deck-1",
      "fingerprint": "fingerprint:deck-1",
      "managerId": "mirabox-main"
    }
  },
  "contract": {
    "contractId": "hardware-contract-1",
    "generation": 1
  },
  "createdAt": "2026-04-29T10:00:00Z",
  "lane": "hardware_messages",
  "messageId": "fixture-hardware-control-input",
  "messageType": "capabilityStateChanged",
  "protocolVersion": "1",
  "recipient": {
    "endpointFamily": "controller",
    "scope": "controllers",
    "targetType": "broadcast"
  },
  "schemaVersion": "1",
  "sender": "hardware_manager:mirabox-main",
  "senderSessionId": "manager-session",
  "subject": {
    "identifiers": {
      "capabilityId": "button.press",
      "controlId": "key.0.0",
      "deviceId": "deck-1",
      "managerId": "mirabox-main"
    },
    "kind": "hardware_capability"
  }
}
