{
  "body": {
    "exchangePattern": "request_reply",
    "intent": "query",
    "name": "searchMusic",
    "params": {},
    "result": {
      "items": []
    },
    "serviceNamespace": "dev.deckr.sonos.service",
    "status": "ok"
  },
  "contract": {
    "contractId": "service-use-contract-1",
    "generation": 1
  },
  "createdAt": "2026-04-29T10:00:00Z",
  "inReplyTo": "fixture-service-message",
  "lane": "services",
  "messageId": "fixture-service-message",
  "messageType": "serviceMessage",
  "protocolVersion": "1",
  "recipient": {
    "endpoint": "controller:controller-main",
    "targetType": "endpoint"
  },
  "recipientSessionId": "controller-session",
  "schemaVersion": "1",
  "sender": "service:sonos-home",
  "senderSessionId": "service-session",
  "subject": {
    "identifiers": {
      "name": "searchMusic",
      "namespace": "dev.deckr.sonos.service",
      "serviceId": "sonos-home"
    },
    "kind": "service"
  }
}
