{
  "body": {
    "event": {
      "metadata": {
        "actionId": "dev.deckr.clock.time",
        "actionInstanceId": "clock-instance-1",
        "configId": "clock-config-1",
        "contextId": "clock-context-1",
        "providerId": "dev.deckr.clock",
        "providerInstanceId": "clock-main"
      },
      "settings": {
        "timezone": "UTC"
      }
    },
    "exchangePattern": "one_way",
    "intent": "event",
    "name": "action_instance_created",
    "params": {},
    "serviceNamespace": "dev.deckr.action_runtime.provider"
  },
  "contract": {
    "contractId": "action-runtime-contract-1",
    "generation": 1
  },
  "createdAt": "2026-04-29T10:00:00Z",
  "lane": "services",
  "messageId": "fixture-action-runtime-action-instance-created",
  "messageType": "serviceMessage",
  "protocolVersion": "1",
  "recipient": {
    "endpoint": "service:action-runtime.clock-main",
    "targetType": "endpoint"
  },
  "recipientSessionId": "service-session",
  "schemaVersion": "1",
  "sender": "controller:controller-main",
  "senderSessionId": "controller-session",
  "subject": {
    "identifiers": {
      "name": "action_instance_created",
      "namespace": "dev.deckr.action_runtime.provider",
      "serviceId": "action-runtime.clock-main"
    },
    "kind": "service"
  }
}
